{
  "approved": false,
  "overallRisk": "HIGH",
  "summary": "PostgreSQL chart upgrade with FIPS compliance changes requiring manual review",
  "findings": [
    {
      "type": "version",
      "title": "postgresql chart 18.0.15 -> 18.1.4",
      "summary": "Unknown security impact due to limited release notes. Major change is addition of OPENSSL_FIPS=yes environment variable which enables FIPS 140-2 compliance mode, potentially breaking compatibility with existing applications and requiring FIPS-enabled OpenSSL build.",
      "risk": "HIGH",
      "tags": [
        "update:chart"
      ],
      "subject": {
        "name": "postgresql",
        "kind": "chart",
        "from": "18.0.15",
        "to": "18.1.4"
      },
      "references": [
        {
          "url": "https://charts.bitnami.com/bitnami/postgresql",
          "note": "Chart repository for Bitnami PostgreSQL."
        },
        {
          "url": "https://github.com/bitnami/charts/tree/main/bitnami/postgresql",
          "note": "Limited official changelog available between versions 18.0.15 and 18.1.4."
        }
      ]
    },
    {
      "type": "resource",
      "title": "StatefulSet/rallly/rallly-postgresql",
      "summary": "Added OPENSSL_FIPS=yes environment variable to PostgreSQL container",
      "risk": "HIGH",
      "tags": [
        "change:container"
      ],
      "cosmetic": false,
      "location": {
        "resource": "StatefulSet/rallly/rallly-postgresql"
      },
      "evidence": {
        "diff": "+        - name: OPENSSL_FIPS\n+          value: \"yes\"",
        "yaml": "environment: OPENSSL_FIPS=yes enables FIPS 140-2 cryptographic compliance mode"
      }
    },
    {
      "type": "resource",
      "title": "Service/rallly/rallly-postgresql-hl",
      "summary": "Removed explicit sessionAffinity: None from Service spec",
      "risk": "LOW",
      "tags": [
        "change:kubernetes"
      ],
      "cosmetic": true,
      "location": {
        "resource": "Service/rallly/rallly-postgresql-hl"
      },
      "evidence": {
        "diff": "-  sessionAffinity: None",
        "yaml": "Removal of explicit default value, no functional impact"
      }
    },
    {
      "type": "resource",
      "title": "Secret/rallly/rallly-postgresql",
      "summary": "PostgreSQL password regenerated during chart upgrade",
      "risk": "LOW",
      "tags": [
        "change:kubernetes"
      ],
      "cosmetic": false,
      "location": {
        "resource": "Secret/rallly/rallly-postgresql"
      },
      "evidence": {
        "diff": "-  postgres-password: cDR1UXliTzQyTQ==\n+  postgres-password: Mm1aaVIxQVM2cQ==",
        "yaml": "Expected password regeneration behavior during Helm chart upgrade"
      }
    },
    {
      "type": "resource",
      "title": "HelmMetadata/rallly/postgresql",
      "summary": "Chart version updated from postgresql-18.0.15 to postgresql-18.1.4",
      "risk": "HIGH",
      "tags": [
        "change:helm"
      ],
      "cosmetic": false,
      "location": {
        "resource": "HelmMetadata/rallly/postgresql"
      },
      "evidence": {
        "diff": "-    helm.sh/chart: postgresql-18.0.15\n+    helm.sh/chart: postgresql-18.1.4",
        "yaml": "Chart version bump with unknown security implications"
      }
    }
  ]
}
